<?xml version="1.0" ?>
<!-- Execution Control List Descriptor v0.2 -->
<!-- Compatible with version 0.1 of ssidset.xsd schema and script vx.y.z -->
<execcontroldata
xmlns="http://www.zeemanconsult.com"
xmlns:xsi="http://www.w3.org/2001/XMLSchema-instance"
xsi:schemaLocation="http://www.zeemanconsult.com /home/moxa/paramsets/execlist.xsd">
   <globalparams>
      <psname>Execution Control Data demo</psname>
      <psversion>v0.1</psversion>
	  <!-- date is expected in dd/mm/yyyy format -->
      <psdate>16/04/2026</psdate>
   </globalparams>
   <commonparams>
      <credentials-dirpath>$HOME/.gpwac</credentials-dirpath>
      <config-dirpath>$HOME/gpwac/default-configs</config-dirpath>
      <ip-xml-dirpath>$HOME/gpwac/xml</ip-xml-dirpath>
      <ip-xsd-fullpath>$HOME/gpwac/xsd/ipset.xsd</ip-xsd-fullpath>
      <ssid-xml-dirpath>$HOME/gpwac/xml</ssid-xml-dirpath>
      <ssid-xsd-fullpath>$HOME/gpwac/xsd/ssidset.xsd</ssid-xsd-fullpath>
   </commonparams>
   <execlist>
      <execrecord>
         <active>true</active>
	     <start-with-default-config>true</start-with-default-config>
         <credentials-file>southdeep-cred.age</credentials-file>
         <config-dir>awk-3252a_gfsd_recd</config-dir>
         <initial-ip-address>192.168.127.253</initial-ip-address>
         <target-ip-address>192.168.127.200</target-ip-address>
         <ip-xml-filename>ipset_1.xml</ip-xml-filename>
         <ssid-xml-filename>ssidset1.xml</ssid-xml-filename>
      </execrecord>
      <execrecord>
         <active>true</active>
	     <start-with-default-config>false</start-with-default-config>
         <credentials-file>southdeep-cred.age</credentials-file>
         <config-dir>awk-3252a_gfsd_recd</config-dir>
         <initial-ip-address>192.168.127.200</initial-ip-address>
         <target-ip-address>192.168.127.253</target-ip-address>
         <ip-xml-filename>ipset_1.xml</ip-xml-filename>
         <ssid-xml-filename>ssidset2.xml</ssid-xml-filename>
      </execrecord>
   </execlist>
</execcontroldata>